{
  "$schema": "./roadmap.schema.json",
  "schemaVersion": "1.0.0",
  "metadata": {
    "product": "HoloMart",
    "title": "Evidence-backed synthetic product roadmap",
    "updatedAt": "2026-07-30T14:00:00Z",
    "authoritative": true,
    "provenance": {
      "label": "SYNTHETIC / DEMO-ONLY",
      "description": "All initiatives, evidence references, dates, owners, prices, and issue drafts are fictional planning material created for a Copilot-for-Product demo.",
      "limitations": [
        "No item is a shopper, seller, or production commitment.",
        "Evidence is deliberately small, invented, and contradictory.",
        "Targets are proposed decision aids rather than measured baselines.",
        "Human decision flags must not be resolved automatically."
      ]
    },
    "sources": [
      "./brief.md",
      "./saved-searches-spec.md",
      "./decisions/0001-saved-searches-local-preview.md",
      "./evidence/README.md",
      "../design/saved-searches-ux-brief.md",
      "../design/local-design-context.json"
    ]
  },
  "horizons": [
    {
      "id": "now",
      "label": "Now",
      "order": 1,
      "definition": "Active discovery and preview-hardening work through September 2026; timing is illustrative."
    },
    {
      "id": "next",
      "label": "Next",
      "order": 2,
      "definition": "Gated options for October through December 2026, entered only after explicit evidence and risk review."
    },
    {
      "id": "later",
      "label": "Later",
      "order": 3,
      "definition": "Uncommitted opportunities for 2027 or later; sequence and scope remain open."
    }
  ],
  "initiatives": [
    {
      "id": "init-saved-searches-preview",
      "title": "Harden personal Saved Searches preview",
      "outcome": "Repeat collectors can safely reuse and understand a browser-local card search without mistaking it for account sync or a price alert.",
      "horizon": "now",
      "status": "in-progress",
      "confidence": "medium",
      "impact": "high",
      "effort": "medium",
      "targetWindow": {
        "label": "Preview hardening, August–September 2026",
        "start": "2026-08-03",
        "end": "2026-09-25"
      },
      "ownerRole": "Product manager, Collector experience",
      "dependencies": [],
      "evidenceReferences": [
        {
          "id": "CI-01",
          "type": "customer-interview",
          "path": "./evidence/shopper-research-signals.md#ci-01--repeat-chase-card-search",
          "summary": "A fictional collector repeatedly rebuilds the same narrow chase-card search."
        },
        {
          "id": "CI-03",
          "type": "customer-interview",
          "path": "./evidence/shopper-research-signals.md#ci-03--stale-criteria-and-trust",
          "summary": "A synthetic participant prioritizes explanation when catalog taxonomy changes."
        },
        {
          "id": "CI-04",
          "type": "customer-interview",
          "path": "./evidence/shopper-research-signals.md#ci-04--occasional-gift-buyer",
          "summary": "An occasional buyer questions whether Saved Searches is relevant."
        },
        {
          "id": "SS-01",
          "type": "support-signal",
          "path": "./evidence/shopper-research-signals.md#ss-01--saved-searches-disappeared",
          "summary": "A fictional ticket exposes an expectation that local searches follow an account."
        },
        {
          "id": "SS-02",
          "type": "support-signal",
          "path": "./evidence/shopper-research-signals.md#ss-02--duplicate-search-names",
          "summary": "Duplicate local names make search management ambiguous."
        },
        {
          "id": "SS-03",
          "type": "support-signal",
          "path": "./evidence/shopper-research-signals.md#ss-03--stale-expansion-filter",
          "summary": "Removed expansion values require explicit recovery."
        },
        {
          "id": "SS-05",
          "type": "support-signal",
          "path": "./evidence/shopper-research-signals.md#ss-05--accidental-overwrite-concern",
          "summary": "Apply, update, and save-as-new semantics need separation."
        },
        {
          "id": "AN-03",
          "type": "usage-analytics",
          "path": "./evidence/usage-analytics.json",
          "summary": "Synthetic later-session reuse is directional, not causal."
        },
        {
          "id": "AN-06",
          "type": "usage-analytics",
          "path": "./evidence/usage-analytics.json",
          "summary": "Invented parse errors make safe recovery a preview requirement."
        },
        {
          "id": "MK-06",
          "type": "market-note",
          "path": "./evidence/market-notes.md#market-and-competitive-notes",
          "summary": "Mutable marketplace taxonomies make stale-search recovery foundational."
        }
      ],
      "evidenceCount": 10,
      "risks": [
        {
          "id": "risk-silent-stale-search",
          "description": "Removed expansion or rarity values could silently broaden results.",
          "likelihood": "medium",
          "impact": "high",
          "mitigation": "Version and validate stored state, explain omissions, and never substitute criteria silently."
        },
        {
          "id": "risk-local-expectation-gap",
          "description": "Shoppers may expect searches to follow their account across devices.",
          "likelihood": "high",
          "impact": "medium",
          "mitigation": "Repeat clear device-local language at create and manage surfaces."
        },
        {
          "id": "risk-alert-consent-confusion",
          "description": "Saving could be mistaken for subscribing to price alerts.",
          "likelihood": "medium",
          "impact": "high",
          "mitigation": "State that no alert is created and keep future opt-in separate."
        }
      ],
      "humanDecisionFlags": [
        {
          "id": "decision-duplicate-search-names",
          "question": "Should local search names be unique, repeatable, or automatically disambiguated?",
          "requiredBy": "Before create-flow acceptance criteria are finalized",
          "status": "open",
          "options": ["Require unique names", "Allow duplicates with metadata", "Automatically disambiguate"]
        },
        {
          "id": "decision-invalid-search-criteria",
          "question": "Should a partly invalid search apply safe criteria or stop for review?",
          "requiredBy": "Before recovery behavior ships",
          "status": "open",
          "options": ["Explain and partially apply", "Stop and require review", "Choose by criterion type"]
        },
        {
          "id": "decision-search-preview-exit",
          "question": "What reliability, accessibility, and reuse evidence is sufficient to reconsider account sync?",
          "requiredBy": "September 2026 roadmap review",
          "status": "open",
          "options": ["Keep local preview", "Run bounded account-sync experiment", "Remove the preview"]
        }
      ],
      "successMeasures": [
        {
          "metric": "Later-session reuse rate",
          "criterion": "Review directional movement among eligible synthetic shoppers; no single threshold triggers release.",
          "source": "./evidence/usage-analytics.json#proposedMetricDefinitions",
          "guardrail": false
        },
        {
          "metric": "Accessible core-flow completion",
          "criterion": "Create, apply, rename, delete, and recover complete with keyboard and supported screen-reader checks.",
          "source": "../design/saved-searches-ux-brief.md#accessibility",
          "guardrail": true
        },
        {
          "metric": "Unintended alert subscriptions",
          "criterion": "Zero; saving a search never creates an alert.",
          "source": "./saved-searches-spec.md#proposed-acceptance-boundaries",
          "guardrail": true
        }
      ],
      "issueDraft": {
        "title": "[Synthetic demo] Harden browser-local Saved Searches preview",
        "body": "## Outcome\nMake personal Saved Searches reliable, understandable, and accessible while keeping them explicitly device-local.\n\n## Evidence\nReview the synthetic references on initiative `init-saved-searches-preview`; they include repeat-use signals and counter-signals about reach, stale taxonomy, sync expectations, and alert consent.\n\n## Boundaries\nNo account sync, price alerts, listing snapshots, card images, or sensitive telemetry. Human decisions remain open.\n\n## Done when\nCore flows meet the approved acceptance boundary, corrupt state is recoverable, stale criteria are explained, and saving never implies notification consent.",
        "labels": ["synthetic-demo", "product", "saved-searches", "preview"],
        "childWorkItems": [
          {
            "id": "work-search-storage-validation",
            "title": "Version and validate local search records",
            "acceptanceCriteria": [
              "Unsupported or corrupt records cannot block the card catalog.",
              "Stored records exclude listing snapshots, prices, card identities, and alert consent."
            ],
            "dependencies": []
          },
          {
            "id": "work-search-core-flows",
            "title": "Complete create, apply, rename, and delete flows",
            "acceptanceCriteria": [
              "Device-local persistence is explained during creation and management.",
              "Active and edited states are distinct without relying on color."
            ],
            "dependencies": ["work-search-storage-validation"]
          },
          {
            "id": "work-search-recovery",
            "title": "Explain stale expansion and rarity criteria",
            "acceptanceCriteria": [
              "Unavailable criteria are never silently substituted.",
              "The shopper can review, update, or delete an invalid search."
            ],